row_id,type,from,condition,condition_var,condition_type,condition_name,save_name,message_text,choice_1,choice_2,choice_3,choice_4,choice_5,choice_6,choice_7,choice_8,choice_9,choice_10,image,audio,video,obj_id,_nodeId,no_response,_ui_type,_ui_position
1,send_message,start,,,,,,"Superpowers
•	Mag-isip ng kapangyarihan. Halimbawa, pagpunta kahit saan sa isang iglap, paglalakbay sa kahit anong dekada, pagbabasa ng isip. 
•	Tanungin mo ang anak mo ""Kung may kapangyarihan ka na [...] Paano mo Ito gagamitin?
•	Hikayatin mo siya na pangalanan ang kanyang sarili ng pangalang superhero at kailangang i-arte niya ito. 
•	Ngayon hayaan mo siyang pumili ng super power para sa iyo!
•	Siguraduhing ia-arte mo din ito! ",,,,,,,,,,,,,,,a6c4f514-47c0-4773-948c-808f8eb1e511,,execute_actions,;