row_id,type,from,condition,condition_var,condition_type,condition_name,save_name,message_text,choice_1,choice_2,choice_3,choice_4,choice_5,choice_6,choice_7,choice_8,choice_9,choice_10,image,audio,video,obj_id,_nodeId,no_response,_ui_type,_ui_position
1,send_message,start,,,,,,"Superpowers
•	Think of a superpower. For example, going anywhere instantly, travelling in time, reading minds. 
•	Ask your child “If you had the superpower to […] how would you use it?
•	Encourage them to give themselves a superhero name and act it out. 
•	Now let them choose a super power for you!
•	Make sure you act it out too! ",,,,,,,,,,,,,,,a6c4f514-47c0-4773-948c-808f8eb1e511,,execute_actions,;