row_id,type,from,condition,condition_var,condition_type,condition_name,save_name,message_text,choice_1,choice_2,choice_3,choice_4,choice_5,choice_6,choice_7,choice_8,choice_9,choice_10,image,audio,video,obj_id,_nodeId,no_response,_ui_type,_ui_position
1,send_message,start,,,,,,"Dream Travel
•	You can’t travel but you can dream! Ask your teen these questions.
•	Where do you want to travel? How long will you be away? What will you pack? What will you do? What will you see?
•	Look at a map together if you have one.
•	Choose a country that they’ve never heard of and look it up together online.",,,,,,,,,,,,,,,1feb242b-3fcb-41e0-879e-5810cee05181,,execute_actions,;